{
  "projectName": "Relay Forge Portal",
  "industry": "ai",
  "siteType": "customer portal platform",
  "targetAudience": "operations teams evaluating a portal and dashboard platform",
  "goals": ["credibility", "feature explanation", "pricing presentation"],
  "tone": ["smart", "technical", "calm"],
  "requiredSections": ["hero", "features", "pricing"],
  "brand": {
    "primary": "#0A2540",
    "secondary": "#12B981",
    "accent": "#E6F7F1",
    "surface": "#FCFEFD",
    "text": "#0F172A",
    "fontDisplay": "Space Grotesk",
    "fontBody": "IBM Plex Sans",
    "radius": "18px",
    "motion": "gentle"
  }
}
